{
  "type": "object",
  "properties": {
    "plan_id": {
      "type": "string",
      "pattern": "^[0-9a-f]{8}-[0-9a-f]{4}-[0-9a-f]{4}-[0-9a-f]{4}-[0-9a-f]{12}$"
    },
    "plan_sha256": {
      "type": "string",
      "pattern": "^[0-9a-f]{64}$"
    },
    "case_manifest_sha256": {
      "type": "string",
      "pattern": "^[0-9a-f]{64}$"
    },
    "policy_id": {
      "type": "string",
      "pattern": "^[0-9a-f]{8}-[0-9a-f]{4}-[0-9a-f]{4}-[0-9a-f]{4}-[0-9a-f]{12}$"
    },
    "policy_version": {
      "type": "integer",
      "minimum": 0
    },
    "valid_from": {
      "type": "string",
      "pattern": "^\\d{4}-\\d{2}-\\d{2}T\\d{2}:\\d{2}:\\d{2}(\\.\\d+)?Z$"
    },
    "valid_until": {
      "type": "string",
      "pattern": "^\\d{4}-\\d{2}-\\d{2}T\\d{2}:\\d{2}:\\d{2}(\\.\\d+)?Z$"
    },
    "case_keys": {
      "type": "array",
      "items": {
        "type": "string",
        "minLength": 1
      },
      "minItems": 1
    },
    "preset": {
      "type": "string",
      "minLength": 1
    },
    "budget_seconds": {
      "type": "number",
      "minimum": 0
    },
    "cleanup_reserve_seconds": {
      "type": "number",
      "minimum": 0
    },
    "priorities": {
      "type": "object"
    },
    "schema_version": {
      "const": 1
    },
    "extensions": {
      "type": "object"
    },
    "protocol_version": {
      "const": "latency-v1"
    }
  },
  "required": [
    "plan_id",
    "plan_sha256",
    "case_manifest_sha256",
    "policy_id",
    "policy_version",
    "valid_from",
    "valid_until",
    "case_keys",
    "preset",
    "budget_seconds",
    "cleanup_reserve_seconds",
    "priorities",
    "schema_version",
    "extensions",
    "protocol_version"
  ],
  "additionalProperties": false,
  "$schema": "https://json-schema.org/draft/2020-12/schema",
  "$id": "https://kernelx.invalid/schema/v1/plan",
  "$defs": {}
}
